{"audit_event_ids":["event.564afdc8438c395cabf7e334","event.01d350d1ace9e3e275e6ec56","event.4fa2c0f2b51a965b36b80dd6","event.8abea3af254408a9c0a432b7","event.c8f97c9faedebf76785fe0e9","event.683a339a6229aceba8768519","event.fd06103a652d4a212a607770","event.index.473dadcf3f48cf4aa61e443e","event.a0eb65592c7500ca4a3492c7","event.d25dbf857faba1e8281bc20a","event.fc8339ad3e525c054677adaa","event.1a56118c2618b6e96df88051","event.5a9fd7ce3cb9b60d9ae76ed8","event.1f08a071a4611fef227598bd","event.44d360999794e6cf21c3cd5d","event.5ea5c69498d6b3f8fb76e43d","event.ad4686c821c2ed439370a6e7","event.88e7a9c0d01e41db2b244855","event.591869f49235d1cdf9fa9e4d","event.18c28f140448b0bf99534656"],"content_hash":"sha256:99891f3b0acd8493adae7976caad8d493995adf2c68522bca2e8da6845e21e4c","created_at":"2026-08-19T00:00:00Z","created_by":"actor.phase3a.operator","evidence_packs":[{"byte_budget":65536,"content_hash":"sha256:e4bb4679cd206f91800e08dd2e4f8b64e0cd921d4b3e3fe73f23ec7075e1921a","created_at":"2026-08-19T00:00:00Z","created_by":"actor.phase3a.operator","excluded_items":[],"id":"evidence-pack.1271c1dda2ea22af4a6f90f9","included_evidence_unit_ids":["evidence.8d533cffa32e1320687905f0","evidence.0fe28c21e8192c88b349f453","evidence.75b93ef280335eeafb6c3c56","evidence.bbf31675257f403279cb0e92","evidence.d748ce5c3b88eae725e0dba3"],"included_source_artifact_ids":["artifact.cd50a003848c060749fcaceb","artifact.f561fe3d16db4b0be1b26727"],"included_source_span_ids":["span.e71871223d06c5530955e9cd","span.c21d075767e810798c8c38df","span.c6631e6a610d57db3bbe4549","span.f2c530ef15d5967f63a599c5","span.9b0818460e0666c226885327"],"injection_annotations":[],"policy_version":"evidence-pack-v1","query_id":"retrieval-query.5049726f0acfad74bc49bb18","retrieval_result_hash":"sha256:618f75d27b1f804fba6ee4a8ee19bbe77bbe1f2303965641ae9b681838142ad7","schema_version":"1.0.0","serialized_pack_artifact_hash":"sha256:ad02d88a8f9b5ad38ff89a467a47c6751668afe4222fb5c11a4358003c69e6de","source_diversity_policy":{"application_order":"before_budget_fill","per_source_cap":3},"token_budget":null,"token_counter_id":null},{"byte_budget":65536,"content_hash":"sha256:350f99ce373ed0d8e52922be6b0600e0bac86d22aca2b9805099b502dd600f80","created_at":"2026-08-19T00:00:00Z","created_by":"actor.phase3a.operator","excluded_items":[{"evidence_unit_id":"evidence.bea51a46114078c9b5de97d1","reason":"source_cap"}],"id":"evidence-pack.4abd4b4a1579a24921a33989","included_evidence_unit_ids":["evidence.4c36e8c93027cdbc7061c00c","evidence.7bdb12f463a72fc26606d9b1","evidence.75b93ef280335eeafb6c3c56","evidence.8d533cffa32e1320687905f0"],"included_source_artifact_ids":["artifact.f561fe3d16db4b0be1b26727","artifact.cd50a003848c060749fcaceb"],"included_source_span_ids":["span.0217885076f467eaca6f5deb","span.0135f1c4422daed5f237efc6","span.c6631e6a610d57db3bbe4549","span.e71871223d06c5530955e9cd"],"injection_annotations":[],"policy_version":"evidence-pack-v1","query_id":"retrieval-query.70b07aafa735d27313567650","retrieval_result_hash":"sha256:2a4be2cc3f50396b8986f8a711376f7cc45212eb18dbeb1bf4b517f643290db3","schema_version":"1.0.0","serialized_pack_artifact_hash":"sha256:4a0fb86ccdbdf102e499e25b510a7aeb301c409e37f2fdbb4808dad1e5f3d16e","source_diversity_policy":{"application_order":"before_budget_fill","per_source_cap":3},"token_budget":null,"token_counter_id":null},{"byte_budget":65536,"content_hash":"sha256:75681bf5925fdb9da0d511db095da3fa175bbaa7b2818475488886eeaace34f0","created_at":"2026-08-19T00:00:00Z","created_by":"actor.phase3a.operator","excluded_items":[],"id":"evidence-pack.64370907f55d71bafc62e52d","included_evidence_unit_ids":["evidence.f9c5042ac590fb15e7aa34f0","evidence.abaa90e1a27558fe8e61ff3a","evidence.3913b6733e885820c0340726","evidence.4c36e8c93027cdbc7061c00c","evidence.dee6c1097974bc03faab6706"],"included_source_artifact_ids":["artifact.d66ab4323f57bab804953aeb","artifact.f561fe3d16db4b0be1b26727"],"included_source_span_ids":["span.858c9f9822402790c8a15149","span.5f6803e0881e7a7e37952177","span.ac842ae4deb862ac2d5520fd","span.0217885076f467eaca6f5deb","span.1bdd910d6e2f8a683891bdaa"],"injection_annotations":[],"policy_version":"evidence-pack-v1","query_id":"retrieval-query.02c00cf1766a35889938eaec","retrieval_result_hash":"sha256:329b290c96e4a1346ddaecff5bf3972d456e2260b0cd963cd05647e09e90f70a","schema_version":"1.0.0","serialized_pack_artifact_hash":"sha256:0bac8bb36d6d60c581a1cc955383dd5572ca7eb9c495e7f24af5143c5a4fbd67","source_diversity_policy":{"application_order":"before_budget_fill","per_source_cap":3},"token_budget":null,"token_counter_id":null},{"byte_budget":65536,"content_hash":"sha256:467e5b0a9bd4a69dc25c80bfdfce10fd25c346ef35520a73be7488b8e243e2a2","created_at":"2026-08-19T00:00:00Z","created_by":"actor.phase3a.operator","excluded_items":[],"id":"evidence-pack.edd49ddb2bf6929542f14bf8","included_evidence_unit_ids":["evidence.abaa90e1a27558fe8e61ff3a","evidence.0fe28c21e8192c88b349f453","evidence.dee6c1097974bc03faab6706","evidence.f9c5042ac590fb15e7aa34f0"],"included_source_artifact_ids":["artifact.f561fe3d16db4b0be1b26727","artifact.cd50a003848c060749fcaceb","artifact.d66ab4323f57bab804953aeb"],"included_source_span_ids":["span.5f6803e0881e7a7e37952177","span.c21d075767e810798c8c38df","span.1bdd910d6e2f8a683891bdaa","span.858c9f9822402790c8a15149"],"injection_annotations":[],"policy_version":"evidence-pack-v1","query_id":"retrieval-query.32a3eab5e31ea7c182e2a96b","retrieval_result_hash":"sha256:38b9645bd44ac5035fa73a7ef2bcfe305b2bba5f061b2ef9161ce8cb0f190eaf","schema_version":"1.0.0","serialized_pack_artifact_hash":"sha256:f0d80702660c5dac53b9fb0c86a778cd49c37eace89a5d6a2a28fd30ceecc7d0","source_diversity_policy":{"application_order":"before_budget_fill","per_source_cap":3},"token_budget":null,"token_counter_id":null}],"evidence_relations":[{"assertion_origin":"operator_asserted","assertion_span_ids":["span.e71871223d06c5530955e9cd"],"content_hash":"sha256:b7f79ce34a4e5995aeaf15c279a0ec1881a130c25bdd55569a56ec753e18426b","created_at":"2026-08-19T00:00:00Z","created_by":"actor.phase3a.operator","disposition":"proposal","extraction_or_actor_id":"actor.phase3a.operator","id":"relation.0244fa7e61493e87d61c9cde","relation_type":"contradicts","review_record_ids":[],"schema_version":"1.0.0","source_unit_id":"evidence.8d533cffa32e1320687905f0","target_unit_id":"evidence.abaa90e1a27558fe8e61ff3a"}],"evidence_units":[{"content_hash":"sha256:25af6c2bdb3dd3a53645fb9e61bdabfb0477d42b2aad583f2d6ce903785010ac","created_at":"2026-08-19T00:00:00Z","created_by":"actor.phase3a.operator","disposition":"proposal","extraction_method":"plain-text-v1","extraction_version":"1.0.0","id":"evidence.0fe28c21e8192c88b349f453","model_call_id":null,"normalized_document_id":"document.ba0abbaa99fd1a0760c4523c","origin":"parser_derived","payload":{"label":"contradiction-note","language":"en","verbatim_text":"This source conflicts with the immutable provenance rule and is retained rather than reconciled away."},"proposal_artifact_hash":null,"schema_version":"1.0.0","source_artifact_id":"artifact.cd50a003848c060749fcaceb","source_span_ids":["span.c21d075767e810798c8c38df"],"unit_type":"source_passage","warning_codes":[]},{"content_hash":"sha256:0a378b0e3e9f14afb76ac13daec23ef5ba199164d5aaf495ad4027d813371eae","created_at":"2026-08-19T00:00:00Z","created_by":"actor.phase3a.operator","disposition":"proposal","extraction_method":"plain-text-v1","extraction_version":"1.0.0","id":"evidence.2c97c721fba0c9977be93bdb","model_call_id":null,"normalized_document_id":"document.d88d170665e9d0d01f553445","origin":"parser_derived","payload":{"citation_text":"AdaIvy Phase 3A canonical research-memory contract.","identifier_candidates":{},"resolved_source_reference_id":null},"proposal_artifact_hash":null,"schema_version":"1.0.0","source_artifact_id":"artifact.f561fe3d16db4b0be1b26727","source_span_ids":["span.ea82ad7e32050c691f3d5989"],"unit_type":"bibliographic_reference","warning_codes":[]},{"content_hash":"sha256:753f10f7bbf8f7b3651db0b9a6ba05d9ed1fe24db476224340e72c88a69b4468","created_at":"2026-08-19T00:00:00Z","created_by":"actor.phase3a.operator","disposition":"proposal","extraction_method":"plain-text-v1","extraction_version":"1.0.0","id":"evidence.3913b6733e885820c0340726","model_call_id":null,"normalized_document_id":"document.2d9afd38c08a00c26f2df130","origin":"parser_derived","payload":{"label":"applicability-boundary","language":"en","verbatim_text":"Citation identity does not establish mathematical applicability or create an epistemic warrant."},"proposal_artifact_hash":null,"schema_version":"1.0.0","source_artifact_id":"artifact.d66ab4323f57bab804953aeb","source_span_ids":["span.ac842ae4deb862ac2d5520fd"],"unit_type":"source_passage","warning_codes":[]},{"content_hash":"sha256:13228325a0f2f19ca7981a136c87be5b29f2822e37c086037b5f87e7e9ff9af3","created_at":"2026-08-19T00:00:00Z","created_by":"actor.phase3a.operator","disposition":"proposal","extraction_method":"plain-text-v1","extraction_version":"1.0.0","id":"evidence.4c36e8c93027cdbc7061c00c","model_call_id":null,"normalized_document_id":"document.d88d170665e9d0d01f553445","origin":"parser_derived","payload":{"hypotheses":{},"label":"deterministic-retrieval","scope":"source","statement":"Deterministic retrieval preserves ordered evidence identifiers across restart.","verbatim_text":"Deterministic retrieval preserves ordered evidence identifiers across restart."},"proposal_artifact_hash":null,"schema_version":"1.0.0","source_artifact_id":"artifact.f561fe3d16db4b0be1b26727","source_span_ids":["span.0217885076f467eaca6f5deb"],"unit_type":"theorem_or_proposition","warning_codes":[]},{"content_hash":"sha256:cebc7e04e4df65dcc21e364acd76ffcbe4f81a05681a23f848a2a44533ee83a6","created_at":"2026-08-19T00:00:00Z","created_by":"actor.phase3a.operator","disposition":"proposal","extraction_method":"plain-text-v1","extraction_version":"1.0.0","id":"evidence.75b93ef280335eeafb6c3c56","model_call_id":null,"normalized_document_id":"document.d88d170665e9d0d01f5